Polytechnic,Year,School,Course_name,Course_code,Course_description,reference,elr2b2_type,elr2b2,planned_intake
SP,2019,School of Mechanical & Aeronautical Engineering,Diploma in Mechanical Engineering,S91,"SP Diploma in Mechanical Engineering covers the areas of mechanical technology, precision engineering, resort facilities management and more.",https://www.sp.edu.sg/engineering-cluster/mae/courses/full-time-diplomas/mechanical-engineering,,,
SP,2019,"Media, Arts & Design School (MAD)",Diploma in Experience & Communication Design,S93,"SP Diploma in Experience and Communication Design exposes you to the many facets of experience and communication design -- graphic design advertising, branding, digital photography, illustration, video production and interaction design.",https://www.sp.edu.sg/mad/courses/full-time-diplomas/experience-and-communication-design,,,
SP,2019,School of Architecture & the Built Environment,Diploma in Landscape Architecture,S94,"SP Diploma in Landscape Architecture covers landscape management, landscape design and technology, horticulture, environmental systems and more.",https://www.sp.edu.sg/abe/courses/full-time-diplomas/landscape-architecture,,,
SP,2019,School of Architecture & the Built Environment,Diploma in Facilities Management,S95,"SP Diploma in Hotel and Leisure Facilities Management covers tourism and leisure management, environmental sustainability and more.",https://www.sp.edu.sg/abe/courses/full-time-diplomas/hotel-leisure-facilities-management,,,
SP,2019,"Media, Arts & Design School (MAD)",Diploma in Music & Audio Technology,S97,"SP Diploma in Music and Audio Technology covers creation and production of music and audio, focusing on its integration and more.",https://www.sp.edu.sg/mad/courses/full-time-diplomas/music-audio-technology,,,
SP,2019,School of Chemical & Life Sciences,Diploma in Biomedical Science,S98,"SP Diploma in Biomedical Science covers the areas of biological science, cardiac technology, management and prevention of diseases and more.",https://www.sp.edu.sg/cls/courses/full-time-diplomas/biomedical-science,,,
SP,2019,School of Electrical & Electronic Engineering,Diploma in Electrical & Electronic Engineering,S99,"SP Diploma in Electrical and Electronic Engineering covers aerospace, biomedical, electronic engineering, nano technology and more.",https://www.sp.edu.sg/engineering-cluster/eee/courses/full-time-diplomas/electrical-electronic-engineering,,,
